[
 {
  "id": "G-001",
  "level": "A1.1",
  "label": "be — present affirmative, full forms",
  "form": "I am / you are / he-she-it is / we-you-they are",
  "meaning": "identifies, describes and locates the subject",
  "use": "saying who you are, where you are, how you are",
  "explanation": {
   "en": "English needs a verb in every sentence. To say who or what something is, use am, is or are.",
   "uz": "Ingliz tilida har bir gapda fe'l bo'lishi shart. Kim yoki nima ekanini aytish uchun am, is, are ishlatiladi."
  },
  "diagram": "table",
  "positive_example": "I am a student.",
  "negative_example": "I student.",
  "prerequisites": [],
  "known_errors": [
   "*I student.",
   "*He teacher.",
   "*You is a student.",
   "*I is a teacher."
  ],
  "l1_notes": {
   "uz": "O'zbek tilida hozirgi zamonda bog'lama tushib qoladi ('Men talaba') — ingliz tilida esa 'am/is/are' majburiy.",
   "ru": "В русском связка в настоящем времени опускается ('Я студент') — в английском be обязателен."
  },
  "l1_weight": {
   "uz": 1.6,
   "ru": 1.6,
   "tr": 1.6
  },
  "exercise_types": [
   "tap_pairs",
   "gap_fill_bank",
   "word_bank_build",
   "type_translate_to_l2",
   "listen_choose_image",
   "repeat_after"
  ],
  "can_do": "I can say who I am and where I am from.",
  "first_taught_node": "S01U01N2",
  "status": "published",
  "syllabus_version": "1.0"
 },
 {
  "id": "G-002",
  "level": "A1.1",
  "label": "be — contracted forms",
  "form": "I'm, you're, he's, she's, it's, we're, they're",
  "meaning": "same as full forms",
  "use": "normal spoken and informal written English",
  "explanation": {
   "en": "In speech we almost always join the pronoun and be: I am becomes I'm.",
   "uz": "Nutqda olmosh va 'be' deyarli doim qo'shilib aytiladi: I am → I'm."
  },
  "diagram": "table",
  "positive_example": "She's a teacher.",
  "negative_example": "She is's a teacher.",
  "prerequisites": [
   "G-001"
  ],
  "known_errors": [
   "*Shes a teacher.",
   "*She's is a teacher.",
   "*Yes, I'm."
  ],
  "l1_notes": {
   "uz": "Qisqartma shakl yozuvda ham, nutqda ham normal — lekin qisqa javobda ishlatilmaydi: 'Yes, I am.'"
  },
  "l1_weight": {
   "uz": 1.2
  },
  "exercise_types": [
   "gap_fill_bank",
   "spelling_bee",
   "repeat_after",
   "dictation_sentence",
   "error_correct"
  ],
  "can_do": "I can use short forms like I'm and she's.",
  "first_taught_node": "S01U01N3",
  "status": "published",
  "syllabus_version": "1.0"
 },
 {
  "id": "G-003",
  "level": "A1.1",
  "label": "be — present negative",
  "form": "I'm not / you aren't (you're not) / he isn't (he's not)",
  "meaning": "denies identity, state or location",
  "use": "correcting, denying, saying what is not true",
  "explanation": {
   "en": "Put not after am, is or are. Both he isn't and he's not are correct.",
   "uz": "'not' so'zi am/is/are dan keyin qo'yiladi. 'he isn't' ham, 'he's not' ham to'g'ri."
  },
  "diagram": "table",
  "positive_example": "He isn't a student.",
  "negative_example": "He not a student.",
  "prerequisites": [
   "G-001",
   "G-002"
  ],
  "known_errors": [
   "*He not a student.",
   "*I amn't a teacher.",
   "*She no is a teacher."
  ],
  "l1_notes": {
   "uz": "O'zbekcha inkor fe'lga '-ma' qo'shimchasi bilan yasaladi; ingliz tilida esa alohida 'not' so'zi kerak.",
   "ru": "Русское 'не' ставится перед словом; английское not ставится ПОСЛЕ be."
  },
  "l1_weight": {
   "uz": 1.5,
   "ru": 1.5
  },
  "exercise_types": [
   "gap_fill_bank",
   "transform_sentence",
   "error_correct",
   "word_bank_build",
   "listen_gist_mcq"
  ],
  "can_do": "I can say what is not true about me or others.",
  "first_taught_node": "S01U02N2",
  "status": "published",
  "syllabus_version": "1.0"
 },
 {
  "id": "G-004",
  "level": "A1.1",
  "label": "be — yes/no questions and short answers",
  "form": "Am I…? Are you…? Is he…? — Yes, I am. / No, I'm not.",
  "meaning": "asks for confirmation",
  "use": "checking facts about people and things",
  "explanation": {
   "en": "Put am, is or are before the subject. In short answers, never use a short form after Yes.",
   "uz": "am/is/are ni egadan oldin qo'ying. Qisqa javobda 'Yes' dan keyin qisqartma ishlatilmaydi."
  },
  "diagram": "word_order",
  "positive_example": "Are you a student? — Yes, I am.",
  "negative_example": "You are a student? — Yes, I'm.",
  "prerequisites": [
   "G-001"
  ],
  "contrasts_with": [
   "G-018"
  ],
  "known_errors": [
   "*You are a student?",
   "*Yes, I'm.",
   "*Is you a teacher?",
   "*Are he a student?"
  ],
  "l1_notes": {
   "uz": "O'zbek tilida savol '-mi' yuklamasi bilan yasaladi, so'z tartibi o'zgarmaydi. Ingliz tilida esa fe'l oldinga chiqadi (inversiya).",
   "ru": "В русском вопрос делается интонацией; в английском нужен порядок слов be + подлежащее."
  },
  "l1_weight": {
   "uz": 1.8,
   "ru": 1.8,
   "tr": 1.8
  },
  "exercise_types": [
   "sentence_reorder",
   "word_bank_build",
   "transform_sentence",
   "error_correct",
   "listen_gist_mcq",
   "speak_roleplay"
  ],
  "can_do": "I can ask yes/no questions and answer them correctly.",
  "first_taught_node": "S01U02N2",
  "status": "published",
  "syllabus_version": "1.0"
 },
 {
  "id": "G-005",
  "level": "A1.1",
  "label": "be — wh-questions",
  "form": "What / Where / Who / How + am, is, are + subject",
  "meaning": "asks for specific information",
  "use": "asking name, origin, location, wellbeing",
  "explanation": {
   "en": "Question word first, then am/is/are, then the subject.",
   "uz": "Avval so'roq so'zi, keyin am/is/are, keyin ega."
  },
  "diagram": "word_order",
  "positive_example": "Where are you from?",
  "negative_example": "Where you are from?",
  "prerequisites": [
   "G-004"
  ],
  "known_errors": [
   "*Where you are from?",
   "*What is your name? — My name Aziz.",
   "*How you are?"
  ],
  "l1_notes": {
   "uz": "O'zbekchada so'roq so'zi gap o'rtasida ham kelishi mumkin; ingliz tilida esa doim boshida va undan keyin inversiya bo'ladi."
  },
  "l1_weight": {
   "uz": 1.8,
   "ru": 1.6
  },
  "exercise_types": [
   "sentence_reorder",
   "word_bank_build",
   "gap_fill_bank",
   "speak_roleplay",
   "listen_detail_gap"
  ],
  "can_do": "I can ask for someone's name, country and how they are.",
  "first_taught_node": "S01U02N3",
  "status": "published",
  "syllabus_version": "1.0"
 },
 {
  "id": "G-006",
  "level": "A1.2",
  "label": "be — past (was / were)",
  "form": "I/he/she/it was; you/we/they were; wasn't, weren't",
  "meaning": "identity, state or location in past time",
  "use": "talking about where you were and how things were",
  "explanation": {
   "en": "Was and were are the past of be. Was goes with I, he, she, it. Were goes with you, we, they.",
   "uz": "was va were — 'be' fe'lining o'tgan zamoni. was: I, he, she, it bilan. were: you, we, they bilan."
  },
  "diagram": "table",
  "positive_example": "I was at home yesterday.",
  "negative_example": "I were at home yesterday.",
  "prerequisites": [
   "G-001"
  ],
  "known_errors": [
   "*I were tired.",
   "*They was here.",
   "*Did you was at school?"
  ],
  "l1_notes": {
   "uz": "O'zbekchada 'edi' barcha shaxslar uchun bir xil; ingliz tilida was/were farqlanadi."
  },
  "l1_weight": {
   "uz": 1.3
  },
  "exercise_types": [
   "gap_fill_bank",
   "verb_form_gap",
   "transform_sentence",
   "dictation_sentence",
   "error_correct"
  ],
  "can_do": "I can say where I was and how I felt.",
  "first_taught_node": "S02U06N2",
  "status": "published",
  "syllabus_version": "1.0"
 },
 {
  "id": "G-007",
  "level": "A1.1",
  "label": "there is / there are",
  "form": "There is + singular; There are + plural; There isn't / There aren't; Is there…? Are there…?",
  "meaning": "states existence or presence",
  "use": "describing a room, a town, a picture",
  "explanation": {
   "en": "Use there is / there are to say that something exists. There is not the same as it is.",
   "uz": "Biror narsaning borligini aytish uchun there is / there are ishlatiladi. Bu 'it is' bilan bir xil emas."
  },
  "diagram": "word_order",
  "positive_example": "There are two windows in my room.",
  "negative_example": "In my room have two windows.",
  "prerequisites": [
   "G-001",
   "G-047"
  ],
  "known_errors": [
   "*Have two windows in my room.",
   "*There is three windows.",
   "*It is a lamp in my room."
  ],
  "l1_notes": {
   "uz": "O'zbekchada 'bor/yo'q' ishlatiladi va ega oldinga chiqadi: 'Xonamda ikkita deraza bor'. Ingliz tilida gap doim 'There' bilan boshlanadi.",
   "ru": "Русское 'есть' — здесь нужен формальный подлежащий there."
  },
  "l1_weight": {
   "uz": 1.7,
   "ru": 1.6
  },
  "exercise_types": [
   "gap_fill_bank",
   "word_bank_build",
   "mcq_image",
   "listen_detail_gap",
   "type_translate_to_l2",
   "speak_picture_describe"
  ],
  "can_do": "I can describe what is in a room or a place.",
  "first_taught_node": "S01U05N2",
  "status": "published",
  "syllabus_version": "1.0"
 },
 {
  "id": "G-008",
  "level": "A1.2",
  "label": "there was / there were",
  "form": "There was + singular; There were + plural",
  "meaning": "existence in past time",
  "use": "describing a past place or situation",
  "explanation": {
   "en": "The past of there is / there are.",
   "uz": "there is / there are ning o'tgan zamon shakli."
  },
  "diagram": "table",
  "positive_example": "There were a lot of people at the party.",
  "negative_example": "There was a lot of people at the party.",
  "prerequisites": [
   "G-007",
   "G-006"
  ],
  "known_errors": [
   "*There was many people.",
   "*There were a car."
  ],
  "l1_notes": {
   "uz": "'bor edi' — lekin ingliz tilida son bo'yicha was/were tanlanadi."
  },
  "l1_weight": {
   "uz": 1.3
  },
  "exercise_types": [
   "gap_fill_bank",
   "verb_form_gap",
   "error_correct",
   "dictation_sentence"
  ],
  "can_do": "I can describe a place or event in the past.",
  "first_taught_node": "S02U06N3",
  "status": "published",
  "syllabus_version": "1.0"
 },
 {
  "id": "G-009",
  "level": "A1.1",